{
 "$schema": "https://json-schema.org/draft/2020-12/schema",
 "$id": "rnl-words.schema.json",
 "title": "RNL standard word list",
 "description": "Structure of the RNL standard word list (rnl-words-<version>.json, section 5.3 of the standard).",
 "type": "object",
 "required": [
  "language",
  "version",
  "record",
  "kinds",
  "subobjects",
  "attributes",
  "truth_values",
  "style_properties",
  "style_groups",
  "reserved",
  "keywords"
 ],
 "properties": {
  "$schema": {
   "type": "string"
  },
  "language": {
   "const": "RNL"
  },
  "version": {
   "type": "string",
   "pattern": "^(0|[1-9][0-9]*)\\.(0|[1-9][0-9]*)$",
   "description": "Language version, major.minor (16.1)."
  },
  "description": {
   "type": "string"
  },
  "record": {
   "type": "object",
   "required": [
    "marker",
    "fields"
   ],
   "properties": {
    "marker": {
     "const": "@RNL"
    },
    "section": {
     "$ref": "#/$defs/section"
    },
    "fields": {
     "type": "array",
     "items": {
      "$ref": "#/$defs/field"
     }
    }
   },
   "description": "The record head (2.8)."
  },
  "kinds": {
   "type": "array",
   "items": {
    "$ref": "#/$defs/word"
   },
   "description": "Kind names, used in signatures and in role declarations (5.3, 9.4)."
  },
  "pseudo_kinds": {
   "type": "array",
   "items": {
    "$ref": "#/$defs/named"
   },
   "description": "Names used only in slot signatures; not standard words."
  },
  "takes": {
   "type": "array",
   "items": {
    "$ref": "#/$defs/named"
   },
   "description": "What a slot takes (5.2.1); explanation of the values of slot.takes."
  },
  "subobjects": {
   "type": "array",
   "items": {
    "$ref": "#/$defs/word"
   },
   "description": "Standard sub-object names after :: (6.5)."
  },
  "attributes": {
   "type": "array",
   "items": {
    "$ref": "#/$defs/word"
   },
   "description": "Attribute names that ${...} can read (13.6)."
  },
  "truth_values": {
   "const": [
    "true",
    "false"
   ]
  },
  "style_properties": {
   "type": "array",
   "items": {
    "$ref": "#/$defs/param"
   },
   "description": "Style properties (9.3)."
  },
  "style_groups": {
   "type": "object",
   "additionalProperties": {
    "type": "array",
    "items": {
     "type": "string"
    }
   },
   "description": "Groups of style properties that keywords take as parameters (9.2.5)."
  },
  "reserved": {
   "type": "array",
   "items": {
    "type": "string"
   },
   "description": "Reserved words; empty in 0.2."
  },
  "keywords": {
   "type": "array",
   "items": {
    "$ref": "#/$defs/keyword"
   }
  }
 },
 "$defs": {
  "section": {
   "type": "string",
   "pattern": "^[0-9]+(\\.[0-9]+)*$"
  },
  "since": {
   "type": "string",
   "pattern": "^(0|[1-9][0-9]*)\\.(0|[1-9][0-9]*)$",
   "description": "The language version that added the word (16.1)."
  },
  "word": {
   "type": "object",
   "required": [
    "name",
    "since"
   ],
   "properties": {
    "name": {
     "type": "string"
    },
    "since": {
     "$ref": "#/$defs/since"
    }
   },
   "additionalProperties": false
  },
  "named": {
   "type": "object",
   "required": [
    "name",
    "meaning"
   ],
   "properties": {
    "name": {
     "type": "string"
    },
    "meaning": {
     "type": "string"
    }
   },
   "additionalProperties": false
  },
  "value": {
   "type": [
    "string",
    "number",
    "boolean"
   ]
  },
  "field": {
   "type": "object",
   "required": [
    "name",
    "type",
    "affects_interpretation",
    "since"
   ],
   "properties": {
    "name": {
     "type": "string"
    },
    "type": {
     "enum": [
      "string",
      "enum"
     ]
    },
    "values": {
     "type": "array",
     "items": {
      "type": "string"
     }
    },
    "default": {
     "type": "string"
    },
    "affects_interpretation": {
     "type": "boolean"
    },
    "since": {
     "$ref": "#/$defs/since"
    }
   },
   "additionalProperties": false
  },
  "param": {
   "type": "object",
   "required": [
    "name",
    "type",
    "since"
   ],
   "properties": {
    "name": {
     "type": "string"
    },
    "type": {
     "enum": [
      "number",
      "string",
      "bool",
      "color",
      "enum",
      "array",
      "terminal"
     ],
     "description": "terminal: a terminal number from 1, or a terminal name (6.4); color: \"#RRGGBB\"."
    },
    "values": {
     "type": "array",
     "items": {
      "$ref": "#/$defs/value"
     }
    },
    "required": {
     "type": "boolean"
    },
    "default": {
     "$ref": "#/$defs/value"
    },
    "items": {
     "type": "string",
     "description": "What the items of an array are. A parameter of another type that has items also takes a non-empty array of such values (PIN terminal, 9.2.4)."
    },
    "since": {
     "$ref": "#/$defs/since"
    }
   },
   "additionalProperties": false
  },
  "slot": {
   "type": "object",
   "required": [
    "name",
    "takes",
    "mode"
   ],
   "properties": {
    "name": {
     "type": "string",
     "description": "Slot name; it can be written as a role (5.3)."
    },
    "takes": {
     "enum": [
      "one",
      "set",
      "any",
      "shape",
      "body",
      "definition"
     ]
    },
    "kinds": {
     "type": "array",
     "items": {
      "type": "string"
     },
     "description": "Kind names or pseudo-kinds; for a definition slot: general, symbol or style."
    },
    "mode": {
     "enum": [
      "absorb",
      "enclose"
     ],
     "description": "Consumption mode (5.4): absorbed input is strict, enclosed input tolerant (7.3)."
    },
    "optional": {
     "type": "boolean"
    },
    "at": {
     "enum": [
      "first",
      "last"
     ],
     "description": "Where the definition slot is written (5.6)."
    }
   },
   "additionalProperties": false
  },
  "keyword": {
   "type": "object",
   "required": [
    "keyword",
    "since",
    "group",
    "summary",
    "section",
    "where",
    "slots",
    "params",
    "output",
    "form"
   ],
   "properties": {
    "keyword": {
     "type": "string",
     "pattern": "^[A-Z][A-Z0-9]*(-[A-Z0-9]+)*$"
    },
    "since": {
     "$ref": "#/$defs/since"
    },
    "group": {
     "type": "string"
    },
    "summary": {
     "type": "string"
    },
    "section": {
     "$ref": "#/$defs/section"
    },
    "where": {
     "type": "array",
     "items": {
      "enum": [
       "level",
       "symbol",
       "header",
       "package-header"
      ]
     },
     "description": "level: any record of a level; symbol: a DEFINE-SYMBOL body; header: header records only; package-header: the header record of a package file only."
    },
    "slots": {
     "type": "array",
     "items": {
      "$ref": "#/$defs/slot"
     }
    },
    "role_slots": {
     "type": "boolean",
     "description": "AS, ATTACH: the other slots are the roles of the general definition (9.4)."
    },
    "params": {
     "type": "array",
     "items": {
      "$ref": "#/$defs/param"
     }
    },
    "definition_params": {
     "type": "boolean",
     "description": "AS, ATTACH: the parameters of the general definition are accepted too (9.4)."
    },
    "style": {
     "type": "string",
     "description": "A style group whose properties are parameters too; all: every style property (DEFINE-STYLE)."
    },
    "positional": {
     "type": "array",
     "items": {
      "type": "string"
     },
     "description": "Parameters that can be given by position, in this order; the others only by name (4.2)."
    },
    "at_least_one": {
     "type": "array",
     "items": {
      "type": "string"
     }
    },
    "together": {
     "type": "array",
     "items": {
      "type": "array",
      "items": {
       "type": "string"
      }
     },
     "description": "Parameters given all together or not at all."
    },
    "exclusive": {
     "type": "array",
     "items": {
      "type": "array",
      "items": {
       "type": "string"
      }
     },
     "description": "Parameters that cannot be given together."
    },
    "shape_params": {
     "type": "array",
     "items": {
      "type": "string"
     },
     "description": "Given: the slot takes the centre point; not given: a set of points (9.2.5)."
    },
    "output": {
     "enum": [
      "none",
      "same",
      "target",
      "new",
      "definition"
     ],
     "description": "none: no handle; same: the handle of the input; target: the handle of the target set; new: a new object; definition: a definition."
    },
    "output_kind": {
     "type": "string"
    },
    "selects": {
     "type": "string",
     "description": "Selections: the kind of the members of the resulting set."
    },
    "key_subobject": {
     "type": "boolean",
     "description": "TEXT: with key=, the text is a sub-object of the object it is attached to (13.3)."
    },
    "override": {
     "enum": [
      "key",
      "geometry",
      "queue"
     ],
     "description": "How facts override (5.8); absent: facts accumulate. geometry: geometric facts, resolved by priority and position (8.5); queue: the appearance queue (8.3)."
    },
    "key": {
     "type": "string",
     "description": "What the key of the fact is."
    },
    "form": {
     "type": "string",
     "description": "The standard form (4.3): slots in braces, positional parameters by name."
    },
    "sentence": {
     "type": "string",
     "description": "A standard sentence (4.5, Annex B); informative."
    }
   },
   "additionalProperties": false
  }
 },
 "additionalProperties": false
}
