{
 "$schema": "rnl-words.schema.json",
 "language": "RNL",
 "version": "0.2",
 "description": "Standard word list of RNL 0.2 (section 5.3 and Annex A of rnl-0.2.md).",
 "record": {
  "marker": "@RNL",
  "section": "2.8",
  "fields": [
   {
    "name": "type",
    "type": "enum",
    "values": [
     "authored",
     "generated",
     "header"
    ],
    "default": "authored",
    "affects_interpretation": true,
    "since": "0.2"
   },
   {
    "name": "scope",
    "type": "string",
    "affects_interpretation": true,
    "since": "0.2"
   },
   {
    "name": "priority",
    "type": "enum",
    "values": [
     "disabled",
     "low",
     "normal",
     "high"
    ],
    "default": "normal",
    "affects_interpretation": true,
    "since": "0.2"
   },
   {
    "name": "author",
    "type": "string",
    "affects_interpretation": false,
    "since": "0.2"
   },
   {
    "name": "hash",
    "type": "string",
    "affects_interpretation": false,
    "since": "0.2"
   },
   {
    "name": "modified",
    "type": "string",
    "affects_interpretation": false,
    "since": "0.2"
   }
  ]
 },
 "kinds": [
  {
   "name": "instance",
   "since": "0.2"
  },
  {
   "name": "terminal",
   "since": "0.2"
  },
  {
   "name": "net",
   "since": "0.2"
  },
  {
   "name": "point",
   "since": "0.2"
  },
  {
   "name": "wire",
   "since": "0.2"
  },
  {
   "name": "usage",
   "since": "0.2"
  },
  {
   "name": "bundle",
   "since": "0.2"
  },
  {
   "name": "text",
   "since": "0.2"
  },
  {
   "name": "annotation",
   "since": "0.2"
  },
  {
   "name": "label",
   "since": "0.2"
  }
 ],
 "pseudo_kinds": [
  {
   "name": "any",
   "meaning": "any object"
  },
  {
   "name": "level",
   "meaning": "`#` alone: the level itself"
  },
  {
   "name": "owner",
   "meaning": "`?` alone in a symbol body: the object drawn with the symbol"
  },
  {
   "name": "position",
   "meaning": "the sub-object `::position` of an object (its origin)"
  },
  {
   "name": "locatable",
   "meaning": "an object with a position: instance, bundle, terminal with a pin, point, text, the centre of a graphic written with a centre, a usage drawn at a point of its own, or a set of them (14.1)"
  },
  {
   "name": "orientable",
   "meaning": "an object with an orientation: instance, bundle, usage with a symbol, or a set of them (14.9)"
  },
  {
   "name": "constraint",
   "meaning": "an object made by a constraint keyword"
  },
  {
   "name": "set",
   "meaning": "a set, written as a name"
  }
 ],
 "takes": [
  {
   "name": "one",
   "meaning": "a single object; given a set, the keyword is applied to each member (5.2.1), except that PRIORITY takes a set marked with GROUP as the group itself (14.8)"
  },
  {
   "name": "set",
   "meaning": "a set; loose objects written for the slot form one set (5.2.1)"
  },
  {
   "name": "any",
   "meaning": "one object, or a set taken as a whole"
  },
  {
   "name": "shape",
   "meaning": "a point, or a set of points (two forms of a graphic, 9.2.5)"
  },
  {
   "name": "body",
   "meaning": "statements in braces, enclosed (5.4)"
  },
  {
   "name": "definition",
   "meaning": "a definition: a `$` name, a `%` name bound to a definition, or an anonymous definition (5.6, 6.6)"
  }
 ],
 "subobjects": [
  {
   "name": "position",
   "since": "0.2"
  },
  {
   "name": "net",
   "since": "0.2"
  }
 ],
 "attributes": [
  {
   "name": "name",
   "since": "0.2"
  },
  {
   "name": "value",
   "since": "0.2"
  },
  {
   "name": "model",
   "since": "0.2"
  },
  {
   "name": "type",
   "since": "0.2"
  },
  {
   "name": "net",
   "since": "0.2"
  },
  {
   "name": "x",
   "since": "0.2"
  },
  {
   "name": "y",
   "since": "0.2"
  }
 ],
 "truth_values": [
  "true",
  "false"
 ],
 "style_properties": [
  {
   "name": "linecolor",
   "type": "color",
   "since": "0.2"
  },
  {
   "name": "linestyle",
   "type": "enum",
   "values": [
    "solid",
    "dashed",
    "dotted",
    "dash-dot",
    "double",
    "bold",
    "none"
   ],
   "default": "solid",
   "since": "0.2"
  },
  {
   "name": "linewidth",
   "type": "number",
   "default": 0,
   "since": "0.2"
  },
  {
   "name": "cap",
   "type": "enum",
   "values": [
    "butt",
    "round",
    "square"
   ],
   "since": "0.2"
  },
  {
   "name": "join",
   "type": "enum",
   "values": [
    "miter",
    "round",
    "bevel"
   ],
   "since": "0.2"
  },
  {
   "name": "fillcolor",
   "type": "color",
   "since": "0.2"
  },
  {
   "name": "textcolor",
   "type": "color",
   "since": "0.2"
  },
  {
   "name": "size",
   "type": "number",
   "since": "0.2"
  },
  {
   "name": "font",
   "type": "string",
   "since": "0.2"
  },
  {
   "name": "bold",
   "type": "bool",
   "since": "0.2"
  },
  {
   "name": "italic",
   "type": "bool",
   "since": "0.2"
  },
  {
   "name": "arrowsize",
   "type": "number",
   "since": "0.2"
  }
 ],
 "style_groups": {
  "line": [
   "linecolor",
   "linestyle",
   "linewidth",
   "cap",
   "join",
   "fillcolor",
   "arrowsize"
  ],
  "area": [
   "linecolor",
   "linestyle",
   "linewidth",
   "cap",
   "join",
   "fillcolor"
  ],
  "wire": [
   "linecolor",
   "linestyle",
   "linewidth",
   "cap",
   "join"
  ],
  "text": [
   "textcolor",
   "size",
   "font",
   "bold",
   "italic"
  ]
 },
 "reserved": [],
 "keywords": [
  {
   "keyword": "VERSION",
   "since": "0.2",
   "group": "Header records and packages",
   "summary": "Declares the language version of the file.",
   "section": "16.1",
   "where": [
    "header"
   ],
   "slots": [],
   "params": [
    {
     "name": "version",
     "type": "string",
     "required": true,
     "since": "0.2"
    }
   ],
   "positional": [
    "version"
   ],
   "output": "none",
   "form": "@VERSION(version)"
  },
  {
   "keyword": "PACKAGE",
   "since": "0.2",
   "group": "Header records and packages",
   "summary": "Declares the name and version of a package.",
   "section": "2.7",
   "where": [
    "package-header"
   ],
   "slots": [],
   "params": [
    {
     "name": "name",
     "type": "string",
     "required": true,
     "since": "0.2"
    },
    {
     "name": "version",
     "type": "string",
     "required": true,
     "since": "0.2"
    }
   ],
   "output": "none",
   "form": "@PACKAGE(name=…, version=…)"
  },
  {
   "keyword": "USE-PACKAGE",
   "since": "0.2",
   "group": "Header records and packages",
   "summary": "Uses a package; with a body, an inline package. In the header record of a package file it references another package.",
   "section": "16.2",
   "where": [
    "header",
    "level"
   ],
   "slots": [
    {
     "name": "body",
     "takes": "body",
     "mode": "enclose",
     "optional": true
    }
   ],
   "params": [
    {
     "name": "name",
     "type": "string",
     "required": true,
     "since": "0.2"
    },
    {
     "name": "version",
     "type": "string",
     "since": "0.2"
    },
    {
     "name": "path",
     "type": "string",
     "since": "0.2"
    }
   ],
   "output": "none",
   "form": "@USE-PACKAGE(name=…, version=…, path=…) {body} (optional)"
  },
  {
   "keyword": "ALIAS",
   "since": "0.2",
   "group": "Header records and packages",
   "summary": "Declares another spelling for a standard word or a `$` name; with `definition=`, for a role, parameter or local name of that definition.",
   "section": "16.5",
   "where": [
    "header"
   ],
   "slots": [],
   "params": [
    {
     "name": "alias",
     "type": "string",
     "required": true,
     "since": "0.2"
    },
    {
     "name": "original",
     "type": "string",
     "required": true,
     "since": "0.2"
    },
    {
     "name": "definition",
     "type": "string",
     "since": "0.2"
    }
   ],
   "positional": [
    "alias",
    "original"
   ],
   "output": "none",
   "form": "@ALIAS(alias, original, definition=…)"
  },
  {
   "keyword": "USE-ALIASES",
   "since": "0.2",
   "group": "Header records and packages",
   "summary": "Loads an alias package.",
   "section": "16.5",
   "where": [
    "header"
   ],
   "slots": [],
   "params": [
    {
     "name": "name",
     "type": "string",
     "required": true,
     "since": "0.2"
    },
    {
     "name": "version",
     "type": "string",
     "since": "0.2"
    },
    {
     "name": "path",
     "type": "string",
     "since": "0.2"
    }
   ],
   "output": "none",
   "form": "@USE-ALIASES(name=…, version=…, path=…)"
  },
  {
   "keyword": "DEVICE",
   "since": "0.2",
   "group": "Header records and packages",
   "summary": "Names the terminals of the instances whose name and model match.",
   "section": "6.12",
   "where": [
    "header"
   ],
   "slots": [],
   "params": [
    {
     "name": "name",
     "type": "string",
     "required": true,
     "since": "0.2"
    },
    {
     "name": "model",
     "type": "string",
     "since": "0.2"
    },
    {
     "name": "terminals",
     "type": "array",
     "required": true,
     "items": "terminal names (strings)",
     "since": "0.2"
    }
   ],
   "output": "none",
   "form": "@DEVICE(name=…, model=…, terminals=…)"
  },
  {
   "keyword": "DEFINE-SYMBOL",
   "since": "0.2",
   "group": "Definitions",
   "summary": "Defines a symbol: graphics, pins and texts.",
   "section": "9.2",
   "where": [
    "level",
    "symbol"
   ],
   "slots": [
    {
     "name": "body",
     "takes": "body",
     "mode": "enclose"
    }
   ],
   "params": [
    {
     "name": "box",
     "type": "array",
     "items": "four numbers: x1, y1, x2, y2",
     "since": "0.2"
    }
   ],
   "output": "definition",
   "output_kind": "symbol",
   "form": "@DEFINE-SYMBOL(box=…) {body}",
   "sentence": "$TRI = @DEFINE-SYMBOL {…}"
  },
  {
   "keyword": "DEFINE-STYLE",
   "since": "0.2",
   "group": "Definitions",
   "summary": "Defines a style from style properties, merging the styles in its braces.",
   "section": "9.3",
   "where": [
    "level"
   ],
   "slots": [
    {
     "name": "extends",
     "takes": "body",
     "mode": "enclose",
     "kinds": [
      "style"
     ]
    }
   ],
   "params": [],
   "style": "all",